<?xml version="1.0"?>
<!DOCTYPE GraphCollection SYSTEM "http://www.inf.unibz.it/~blumenthal/dtd/GraphCollection.dtd">
<GraphCollection>
	<graph file="molecule00.gxl" class="0"/>
	<graph file="molecule01.gxl" class="0"/>
	<graph file="molecule02.gxl" class="0"/>
	<graph file="molecule03.gxl" class="0"/>
	<graph file="molecule04.gxl" class="1"/>
	<graph file="molecule05.gxl" class="0"/>
	<graph file="molecule06.gxl" class="0"/>
	<graph file="molecule07.gxl" class="1"/>
	<graph file="molecule08.gxl" class="0"/>
	<graph file="molecule09.gxl" class="0"/>
	<graph file="molecule10.gxl" class="1"/>
	<graph file="molecule11.gxl" class="0"/>
	<graph file="molecule12.gxl" class="0"/>
	<graph file="molecule13.gxl" class="0"/>
	<graph file="molecule14.gxl" class="1"/>
	<graph file="molecule15.gxl" class="0"/>
	<graph file="molecule16.gxl" class="1"/>
	<graph file="molecule17.gxl" class="1"/>
	<graph file="molecule18.gxl" class="1"/>
	<graph file="molecule19.gxl" class="1"/>
	<graph file="molecule20.gxl" class="1"/>
	<graph file="molecule21.gxl" class="1"/>
	<graph file="molecule22.gxl" class="1"/>
	<graph file="molecule23.gxl" class="1"/>
	<graph file="molecule24.gxl" class="0"/>
	<graph file="molecule25.gxl" class="1"/>
	<graph file="molecule26.gxl" class="1"/>
	<graph file="molecule27.gxl" class="1"/>
	<graph file="molecule28.gxl" class="0"/>
	<graph file="molecule29.gxl" class="0"/>
	<graph file="molecule30.gxl" class="0"/>
	<graph file="molecule31.gxl" class="0"/>
	<graph file="molecule32.gxl" class="1"/>
	<graph file="molecule33.gxl" class="1"/>
	<graph file="molecule34.gxl" class="1"/>
	<graph file="molecule35.gxl" class="0"/>
	<graph file="molecule36.gxl" class="1"/>
	<graph file="molecule37.gxl" class="1"/>
	<graph file="molecule38.gxl" class="1"/>
	<graph file="molecule39.gxl" class="0"/>
	<graph file="molecule40.gxl" class="0"/>
	<graph file="molecule41.gxl" class="0"/>
	<graph file="molecule42.gxl" class="0"/>
	<graph file="molecule43.gxl" class="0"/>
	<graph file="molecule44.gxl" class="1"/>
	<graph file="molecule45.gxl" class="1"/>
	<graph file="molecule46.gxl" class="1"/>
	<graph file="molecule47.gxl" class="0"/>
	<graph file="molecule48.gxl" class="0"/>
	<graph file="molecule49.gxl" class="0"/>
	<graph file="molecule50.gxl" class="0"/>
	<graph file="molecule51.gxl" class="0"/>
	<graph file="molecule52.gxl" class="0"/>
	<graph file="molecule53.gxl" class="1"/>
	<graph file="molecule54.gxl" class="0"/>
	<graph file="molecule55.gxl" class="0"/>
	<graph file="molecule56.gxl" class="0"/>
	<graph file="molecule57.gxl" class="0"/>
	<graph file="molecule58.gxl" class="1"/>
	<graph file="molecule59.gxl" class="1"/>
	<graph file="molecule60.gxl" class="1"/>
	<graph file="molecule61.gxl" class="0"/>
	<graph file="molecule62.gxl" class="0"/>
	<graph file="molecule63.gxl" class="0"/>
	<graph file="molecule64.gxl" class="0"/>
	<graph file="molecule65.gxl" class="1"/>
	<graph file="molecule66.gxl" class="1"/>
	<graph file="molecule67.gxl" class="0"/>
</GraphCollection>