<?xml version="1.0"?>
<!DOCTYPE GraphCollection SYSTEM "http://www.inf.unibz.it/~blumenthal/dtd/GraphCollection.dtd">
<GraphCollection>
	<graph file="11-methylbenzo[a]pyrene.gxl" class="1"/>
	<graph file="benzo[c]chrysene.gxl" class="1"/>
	<graph file="3,12-dimethylbenzo[a]pyrene.gxl" class="1"/>
	<graph file="9,10-dimethylanthracene.gxl" class="1"/>
	<graph file="2,3-dimethylbenzo[a]pyrene.gxl" class="1"/>
	<graph file="dibenzo[c,i]pyrene.gxl" class="1"/>
	<graph file="11-methylbenz[a]anthracene.gxl" class="1"/>
	<graph file="dibenz[a,h]anthracene.gxl" class="1"/>
	<graph file="dibenzo[a,e]pyrene.gxl" class="1"/>
	<graph file="benzo[e]pyrene.gxl" class="1"/>
	<graph file="7,12-dimethylbenz[a]anthracene.gxl" class="1"/>
	<graph file="1,2-dimethylbenzo[a]pyrene.gxl" class="1"/>
	<graph file="6,12-dimethylbenz[a]anthracene.gxl" class="1"/>
	<graph file="dibenz[a,j]anthracene.gxl" class="1"/>
	<graph file="2-methylbenzo[a]pyrene.gxl" class="1"/>
	<graph file="benzo[c]phenanthrene.gxl" class="1"/>
	<graph file="8-methylbenz[a]anthracene.gxl" class="1"/>
	<graph file="6,8-dimethylbenz[a]anthracene.gxl" class="1"/>
	<graph file="12-methylbenzo[a]pyrene.gxl" class="1"/>
	<graph file="10-methylbenz[a]anthracene.gxl" class="1"/>
	<graph file="1-methylbenzo[c]phenanthrene.gxl" class="1"/>
	<graph file="dibenzo[a,l]pyrene.gxl" class="1"/>
	<graph file="tribenzo[a,e,i]pyrene.gxl" class="1"/>
	<graph file="1,3-dimethylbenzo[a]pyrene.gxl" class="1"/>
	<graph file="1,4-dimethylbenzo[a]pyrene.gxl" class="1"/>
	<graph file="dibenz[a,c]anthracene.gxl" class="1"/>
	<graph file="3,6-dimethylbenzo[a]pyrene.gxl" class="1"/>
	<graph file="4,5-dimethylbenzo[a]pyrene.gxl" class="1"/>
	<graph file="benzo[g,h,i]perylene.gxl" class="1"/>
	<graph file="6-methylbenzo[c]phenanthrene.gxl" class="1"/>
	<graph file="naphtho(2,3-a)pyrene.gxl" class="1"/>
	<graph file="7,10-dimethylbenzo[a]pyrene.gxl" class="-1"/>
	<graph file="coronene.gxl" class="-1"/>
	<graph file="benzo[c]pentaphene.gxl" class="-1"/>
	<graph file="naphtho[1,2-b]triphenylene.gxl" class="-1"/>
	<graph file="pyrene.gxl" class="-1"/>
	<graph file="pentacene.gxl" class="-1"/>
	<graph file="2-methylbenz[a]anthracene.gxl" class="-1"/>
	<graph file="phenanthrene.gxl" class="-1"/>
	<graph file="benzo[b]chrysene.gxl" class="-1"/>
	<graph file="2-methylpyrene.gxl" class="-1"/>
	<graph file="dibenzo[b,g]phenanthrene.gxl" class="-1"/>
	<graph file="anthra[1,2-a]anthracene.gxl" class="-1"/>
	<graph file="8-methylbenzo[a]pyrene.gxl" class="-1"/>
	<graph file="benzo[a]naphthacene.gxl" class="-1"/>
	<graph file="anthracene.gxl" class="-1"/>
	<graph file="5-methylbenz[a]anthracene.gxl" class="-1"/>
	<graph file="3-methylbenz[a]anthracene.gxl" class="-1"/>
	<graph file="perylene.gxl" class="-1"/>
</GraphCollection>