<?xml version="1.0"?>
<!DOCTYPE GraphCollection SYSTEM "http://www.inf.unibz.it/~blumenthal/dtd/GraphCollection.dtd">
<GraphCollection>
	<graph file="AP1_0099.gxl" class="A"/>
	<graph file="AP1_0079.gxl" class="A"/>
	<graph file="AP1_0127.gxl" class="A"/>
	<graph file="AP1_0013.gxl" class="A"/>
	<graph file="AP1_0044.gxl" class="A"/>
	<graph file="AP1_0104.gxl" class="A"/>
	<graph file="AP1_0038.gxl" class="A"/>
	<graph file="AP1_0148.gxl" class="A"/>
	<graph file="AP1_0134.gxl" class="A"/>
	<graph file="AP1_0139.gxl" class="A"/>
	<graph file="EP1_0051.gxl" class="E"/>
	<graph file="EP1_0062.gxl" class="E"/>
	<graph file="EP1_0006.gxl" class="E"/>
	<graph file="EP1_0042.gxl" class="E"/>
	<graph file="EP1_0111.gxl" class="E"/>
	<graph file="EP1_0038.gxl" class="E"/>
	<graph file="EP1_0126.gxl" class="E"/>
	<graph file="EP1_0096.gxl" class="E"/>
	<graph file="EP1_0027.gxl" class="E"/>
	<graph file="EP1_0030.gxl" class="E"/>
	<graph file="FP1_0111.gxl" class="F"/>
	<graph file="FP1_0038.gxl" class="F"/>
	<graph file="FP1_0112.gxl" class="F"/>
	<graph file="FP1_0105.gxl" class="F"/>
	<graph file="FP1_0136.gxl" class="F"/>
	<graph file="FP1_0044.gxl" class="F"/>
	<graph file="FP1_0080.gxl" class="F"/>
	<graph file="FP1_0039.gxl" class="F"/>
	<graph file="FP1_0018.gxl" class="F"/>
	<graph file="FP1_0049.gxl" class="F"/>
	<graph file="IP1_0117.gxl" class="I"/>
	<graph file="IP1_0128.gxl" class="I"/>
	<graph file="IP1_0144.gxl" class="I"/>
	<graph file="IP1_0032.gxl" class="I"/>
	<graph file="IP1_0039.gxl" class="I"/>
	<graph file="IP1_0067.gxl" class="I"/>
	<graph file="IP1_0090.gxl" class="I"/>
	<graph file="IP1_0133.gxl" class="I"/>
	<graph file="IP1_0028.gxl" class="I"/>
	<graph file="IP1_0007.gxl" class="I"/>
	<graph file="HP1_0126.gxl" class="H"/>
	<graph file="HP1_0128.gxl" class="H"/>
	<graph file="HP1_0103.gxl" class="H"/>
	<graph file="HP1_0015.gxl" class="H"/>
	<graph file="HP1_0130.gxl" class="H"/>
	<graph file="HP1_0013.gxl" class="H"/>
	<graph file="HP1_0028.gxl" class="H"/>
	<graph file="HP1_0051.gxl" class="H"/>
	<graph file="HP1_0005.gxl" class="H"/>
	<graph file="HP1_0149.gxl" class="H"/>
	<graph file="KP1_0125.gxl" class="K"/>
	<graph file="KP1_0146.gxl" class="K"/>
	<graph file="KP1_0003.gxl" class="K"/>
	<graph file="KP1_0068.gxl" class="K"/>
	<graph file="KP1_0091.gxl" class="K"/>
	<graph file="KP1_0120.gxl" class="K"/>
	<graph file="KP1_0018.gxl" class="K"/>
	<graph file="KP1_0070.gxl" class="K"/>
	<graph file="KP1_0088.gxl" class="K"/>
	<graph file="KP1_0082.gxl" class="K"/>
	<graph file="MP1_0124.gxl" class="M"/>
	<graph file="MP1_0113.gxl" class="M"/>
	<graph file="MP1_0048.gxl" class="M"/>
	<graph file="MP1_0021.gxl" class="M"/>
	<graph file="MP1_0125.gxl" class="M"/>
	<graph file="MP1_0129.gxl" class="M"/>
	<graph file="MP1_0020.gxl" class="M"/>
	<graph file="MP1_0000.gxl" class="M"/>
	<graph file="MP1_0041.gxl" class="M"/>
	<graph file="MP1_0070.gxl" class="M"/>
	<graph file="LP1_0145.gxl" class="L"/>
	<graph file="LP1_0133.gxl" class="L"/>
	<graph file="LP1_0010.gxl" class="L"/>
	<graph file="LP1_0036.gxl" class="L"/>
	<graph file="LP1_0100.gxl" class="L"/>
	<graph file="LP1_0094.gxl" class="L"/>
	<graph file="LP1_0002.gxl" class="L"/>
	<graph file="LP1_0117.gxl" class="L"/>
	<graph file="LP1_0026.gxl" class="L"/>
	<graph file="LP1_0029.gxl" class="L"/>
	<graph file="NP1_0027.gxl" class="N"/>
	<graph file="NP1_0036.gxl" class="N"/>
	<graph file="NP1_0046.gxl" class="N"/>
	<graph file="NP1_0042.gxl" class="N"/>
	<graph file="NP1_0088.gxl" class="N"/>
	<graph file="NP1_0038.gxl" class="N"/>
	<graph file="NP1_0129.gxl" class="N"/>
	<graph file="NP1_0053.gxl" class="N"/>
	<graph file="NP1_0052.gxl" class="N"/>
	<graph file="NP1_0039.gxl" class="N"/>
	<graph file="TP1_0103.gxl" class="T"/>
	<graph file="TP1_0068.gxl" class="T"/>
	<graph file="TP1_0049.gxl" class="T"/>
	<graph file="TP1_0126.gxl" class="T"/>
	<graph file="TP1_0016.gxl" class="T"/>
	<graph file="TP1_0138.gxl" class="T"/>
	<graph file="TP1_0074.gxl" class="T"/>
	<graph file="TP1_0134.gxl" class="T"/>
	<graph file="TP1_0025.gxl" class="T"/>
	<graph file="TP1_0102.gxl" class="T"/>
	<graph file="WP1_0049.gxl" class="W"/>
	<graph file="WP1_0118.gxl" class="W"/>
	<graph file="WP1_0104.gxl" class="W"/>
	<graph file="WP1_0111.gxl" class="W"/>
	<graph file="WP1_0075.gxl" class="W"/>
	<graph file="WP1_0036.gxl" class="W"/>
	<graph file="WP1_0087.gxl" class="W"/>
	<graph file="WP1_0054.gxl" class="W"/>
	<graph file="WP1_0078.gxl" class="W"/>
	<graph file="WP1_0050.gxl" class="W"/>
	<graph file="VP1_0011.gxl" class="V"/>
	<graph file="VP1_0060.gxl" class="V"/>
	<graph file="VP1_0092.gxl" class="V"/>
	<graph file="VP1_0056.gxl" class="V"/>
	<graph file="VP1_0049.gxl" class="V"/>
	<graph file="VP1_0134.gxl" class="V"/>
	<graph file="VP1_0119.gxl" class="V"/>
	<graph file="VP1_0029.gxl" class="V"/>
	<graph file="VP1_0020.gxl" class="V"/>
	<graph file="VP1_0109.gxl" class="V"/>
	<graph file="YP1_0045.gxl" class="Y"/>
	<graph file="YP1_0060.gxl" class="Y"/>
	<graph file="YP1_0003.gxl" class="Y"/>
	<graph file="YP1_0074.gxl" class="Y"/>
	<graph file="YP1_0110.gxl" class="Y"/>
	<graph file="YP1_0079.gxl" class="Y"/>
	<graph file="YP1_0024.gxl" class="Y"/>
	<graph file="YP1_0071.gxl" class="Y"/>
	<graph file="YP1_0038.gxl" class="Y"/>
	<graph file="YP1_0130.gxl" class="Y"/>
	<graph file="XP1_0067.gxl" class="X"/>
	<graph file="XP1_0095.gxl" class="X"/>
	<graph file="XP1_0148.gxl" class="X"/>
	<graph file="XP1_0099.gxl" class="X"/>
	<graph file="XP1_0128.gxl" class="X"/>
	<graph file="XP1_0117.gxl" class="X"/>
	<graph file="XP1_0049.gxl" class="X"/>
	<graph file="XP1_0038.gxl" class="X"/>
	<graph file="XP1_0016.gxl" class="X"/>
	<graph file="XP1_0141.gxl" class="X"/>
	<graph file="ZP1_0009.gxl" class="Z"/>
	<graph file="ZP1_0076.gxl" class="Z"/>
	<graph file="ZP1_0097.gxl" class="Z"/>
	<graph file="ZP1_0021.gxl" class="Z"/>
	<graph file="ZP1_0101.gxl" class="Z"/>
	<graph file="ZP1_0044.gxl" class="Z"/>
	<graph file="ZP1_0073.gxl" class="Z"/>
	<graph file="ZP1_0003.gxl" class="Z"/>
	<graph file="ZP1_0096.gxl" class="Z"/>
	<graph file="ZP1_0116.gxl" class="Z"/>
</GraphCollection>