<?xml version="1.0"?>
<!DOCTYPE GraphCollection SYSTEM "http://www.inf.unibz.it/~blumenthal/dtd/GraphCollection.dtd">
<GraphCollection>
<graph file="molecule_50.gxl" class="a"/>
<graph file="molecule_51.gxl" class="a"/>
<graph file="molecule_52.gxl" class="a"/>
<graph file="molecule_53.gxl" class="a"/>
<graph file="molecule_54.gxl" class="a"/>
<graph file="molecule_55.gxl" class="a"/>
<graph file="molecule_56.gxl" class="a"/>
<graph file="molecule_57.gxl" class="a"/>
<graph file="molecule_58.gxl" class="a"/>
<graph file="molecule_59.gxl" class="a"/>
<graph file="molecule_60.gxl" class="a"/>
<graph file="molecule_61.gxl" class="a"/>
<graph file="molecule_62.gxl" class="a"/>
<graph file="molecule_63.gxl" class="a"/>
<graph file="molecule_64.gxl" class="a"/>
<graph file="molecule_65.gxl" class="a"/>
<graph file="molecule_66.gxl" class="a"/>
<graph file="molecule_67.gxl" class="a"/>
<graph file="molecule_68.gxl" class="a"/>
<graph file="molecule_69.gxl" class="a"/>
<graph file="molecule_70.gxl" class="a"/>
<graph file="molecule_71.gxl" class="a"/>
<graph file="molecule_72.gxl" class="a"/>
<graph file="molecule_73.gxl" class="a"/>
<graph file="molecule_74.gxl" class="a"/>
<graph file="molecule_75.gxl" class="a"/>
<graph file="molecule_76.gxl" class="a"/>
<graph file="molecule_77.gxl" class="a"/>
<graph file="molecule_78.gxl" class="a"/>
<graph file="molecule_79.gxl" class="a"/>
<graph file="molecule_80.gxl" class="a"/>
<graph file="molecule_81.gxl" class="a"/>
<graph file="molecule_82.gxl" class="a"/>
<graph file="molecule_83.gxl" class="a"/>
<graph file="molecule_84.gxl" class="a"/>
<graph file="molecule_85.gxl" class="a"/>
<graph file="molecule_86.gxl" class="a"/>
<graph file="molecule_87.gxl" class="a"/>
<graph file="molecule_88.gxl" class="a"/>
<graph file="molecule_89.gxl" class="a"/>
<graph file="molecule_90.gxl" class="a"/>
<graph file="molecule_91.gxl" class="a"/>
<graph file="molecule_92.gxl" class="a"/>
<graph file="molecule_93.gxl" class="a"/>
<graph file="molecule_94.gxl" class="a"/>
<graph file="molecule_95.gxl" class="a"/>
<graph file="molecule_96.gxl" class="a"/>
<graph file="molecule_97.gxl" class="a"/>
<graph file="molecule_98.gxl" class="a"/>
<graph file="molecule_99.gxl" class="a"/>
<graph file="molecule_100.gxl" class="a"/>
<graph file="molecule_101.gxl" class="a"/>
<graph file="molecule_102.gxl" class="a"/>
<graph file="molecule_103.gxl" class="a"/>
<graph file="molecule_104.gxl" class="a"/>
<graph file="molecule_105.gxl" class="a"/>
<graph file="molecule_106.gxl" class="a"/>
<graph file="molecule_107.gxl" class="a"/>
<graph file="molecule_108.gxl" class="a"/>
<graph file="molecule_109.gxl" class="a"/>
<graph file="molecule_110.gxl" class="a"/>
<graph file="molecule_111.gxl" class="a"/>
<graph file="molecule_112.gxl" class="a"/>
<graph file="molecule_113.gxl" class="a"/>
<graph file="molecule_114.gxl" class="a"/>
<graph file="molecule_115.gxl" class="a"/>
<graph file="molecule_116.gxl" class="a"/>
<graph file="molecule_117.gxl" class="a"/>
<graph file="molecule_118.gxl" class="a"/>
<graph file="molecule_119.gxl" class="a"/>
<graph file="molecule_120.gxl" class="a"/>
<graph file="molecule_121.gxl" class="a"/>
<graph file="molecule_122.gxl" class="a"/>
<graph file="molecule_123.gxl" class="a"/>
<graph file="molecule_124.gxl" class="a"/>
<graph file="molecule_125.gxl" class="a"/>
<graph file="molecule_126.gxl" class="a"/>
<graph file="molecule_127.gxl" class="a"/>
<graph file="molecule_128.gxl" class="a"/>
<graph file="molecule_129.gxl" class="a"/>
<graph file="molecule_130.gxl" class="a"/>
<graph file="molecule_131.gxl" class="a"/>
<graph file="molecule_132.gxl" class="a"/>
<graph file="molecule_133.gxl" class="a"/>
<graph file="molecule_134.gxl" class="a"/>
<graph file="molecule_135.gxl" class="a"/>
<graph file="molecule_136.gxl" class="a"/>
<graph file="molecule_137.gxl" class="a"/>
<graph file="molecule_138.gxl" class="a"/>
<graph file="molecule_139.gxl" class="a"/>
<graph file="molecule_140.gxl" class="a"/>
<graph file="molecule_141.gxl" class="a"/>
<graph file="molecule_142.gxl" class="a"/>
<graph file="molecule_143.gxl" class="a"/>
<graph file="molecule_144.gxl" class="a"/>
<graph file="molecule_145.gxl" class="a"/>
<graph file="molecule_146.gxl" class="a"/>
<graph file="molecule_147.gxl" class="a"/>
<graph file="molecule_148.gxl" class="a"/>
<graph file="molecule_149.gxl" class="a"/>
</GraphCollection>
