<?xml version="1.0"?>
<!DOCTYPE GraphCollection SYSTEM "http://www.inf.unibz.it/~blumenthal/dtd/GraphCollection.dtd">
<GraphCollection>
	<graph file="11059.gxl" class="a"/>
	<graph file="11108.gxl" class="a"/>
	<graph file="18434.gxl" class="a"/>
	<graph file="18350.gxl" class="a"/>
	<graph file="33065.gxl" class="a"/>
	<graph file="22710.gxl" class="a"/>
	<graph file="21992.gxl" class="a"/>
	<graph file="41803.gxl" class="a"/>
	<graph file="20076.gxl" class="a"/>
	<graph file="41804.gxl" class="a"/>
</GraphCollection>