<?xml version="1.0"?>
<!DOCTYPE GraphCollection SYSTEM "http://www.inf.unibz.it/~blumenthal/dtd/GraphCollection.dtd">
<GraphCollection>
	<graph file="s1060_05.gxl" class="A "/>
	<graph file="s1933_01.gxl" class="A "/>
	<graph file="f1496_10.gxl" class="A "/>
	<graph file="f0215_01.gxl" class="A "/>
	<graph file="s1586_05.gxl" class="A "/>
	<graph file="f0190_08.gxl" class="A "/>
	<graph file="s1731_04.gxl" class="A "/>
	<graph file="f0230_10.gxl" class="A "/>
	<graph file="f0005_03.gxl" class="A "/>
	<graph file="f1614_09.gxl" class="L "/>
	<graph file="s1105_08.gxl" class="L "/>
	<graph file="s1048_06.gxl" class="L "/>
	<graph file="s0203_10.gxl" class="L "/>
	<graph file="f1247_06.gxl" class="L "/>
	<graph file="f1532_07.gxl" class="L "/>
	<graph file="s1169_07.gxl" class="L "/>
	<graph file="s0534_08.gxl" class="L "/>
	<graph file="f0656_06.gxl" class="L "/>
	<graph file="f1914_05.gxl" class="W "/>
	<graph file="f1459_09.gxl" class="W "/>
	<graph file="s1394_07.gxl" class="W "/>
	<graph file="s1467_09.gxl" class="W "/>
	<graph file="f0533_04.gxl" class="W "/>
	<graph file="s0519_06.gxl" class="W "/>
	<graph file="s1739_01.gxl" class="W "/>
	<graph file="s1863_04.gxl" class="W "/>
	<graph file="f1786_05.gxl" class="W "/>
	<graph file="s1733_02.gxl" class="TR"/>
	<graph file="s0039_03.gxl" class="TR"/>
	<graph file="f1726_02.gxl" class="TR"/>
	<graph file="f1634_09.gxl" class="TL"/>
	<graph file="s1928_02.gxl" class="TL"/>
	<graph file="f1195_01.gxl" class="R "/>
	<graph file="f1889_04.gxl" class="R "/>
	<graph file="s1125_01.gxl" class="R "/>
	<graph file="f1421_04.gxl" class="R "/>
	<graph file="s0157_03.gxl" class="R "/>
	<graph file="f1935_04.gxl" class="R "/>
	<graph file="s1516_02.gxl" class="R "/>
	<graph file="f0068_01.gxl" class="R "/>
	<graph file="s1043_01.gxl" class="R "/>
	<graph file="f0648_07.gxl" class="T "/>
	<graph file="f1275_02.gxl" class="T "/>
	<graph file="f0560_08.gxl" class="TA"/>
</GraphCollection>