<?xml version="1.0"?>
<!DOCTYPE GraphCollection SYSTEM "http://www.inf.unibz.it/~blumenthal/dtd/GraphCollection.dtd">
<GraphCollection>
	<graph file="enzyme_330.gxl" class="4"/>
	<graph file="enzyme_565.gxl" class="6"/>
	<graph file="enzyme_96.gxl" class="1"/>
	<graph file="enzyme_188.gxl" class="2"/>
	<graph file="enzyme_398.gxl" class="4"/>
	<graph file="enzyme_110.gxl" class="2"/>
	<graph file="enzyme_106.gxl" class="2"/>
	<graph file="enzyme_144.gxl" class="2"/>
	<graph file="enzyme_145.gxl" class="2"/>
	<graph file="enzyme_53.gxl" class="1"/>
</GraphCollection>