<?xml version="1.0"?>
<!DOCTYPE GraphCollection SYSTEM "http://www.inf.unibz.it/~blumenthal/dtd/GraphCollection.dtd">
<GraphCollection>
	<graph file="molid663607_subnode_13_to_W.gxl" class="1"/>
	<graph file="molid663607_subnode_3_to_Tl.gxl" class="1"/>
	<graph file="molid663607_subnode_5_to_Se.gxl" class="1"/>
	<graph file="molid663607_subedge_1_2_to_2.gxl" class="1"/>
	<graph file="molid663607_subnode_5_to_Sn.gxl" class="1"/>
	<graph file="molid663607_subnode_10_to_Se.gxl" class="1"/>
	<graph file="molid663607_subnode_5_to_K.gxl" class="1"/>
	<graph file="molid663607_addedge_5_14_label_2.gxl" class="1"/>
	<graph file="molid663607_subnode_3_to_Pd.gxl" class="1"/>
	<graph file="molid663607_subnode_9_to_Zn.gxl" class="1"/>
	<graph file="molid663607_addnode_B.gxl" class="1"/>
	<graph file="molid663607_subnode_6_to_Se.gxl" class="1"/>
	<graph file="molid663607_subnode_9_to_Ru.gxl" class="1"/>
	<graph file="molid663607_subnode_10_to_Ru.gxl" class="1"/>
	<graph file="molid663607_subnode_7_to_S.gxl" class="1"/>
	<graph file="molid663607_addedge_5_6_label_1.gxl" class="1"/>
	<graph file="molid663607_subnode_7_to_Au.gxl" class="1"/>
	<graph file="molid663607_subnode_3_to_Mg.gxl" class="1"/>
	<graph file="molid663607_addedge_0_9_label_2.gxl" class="1"/>
	<graph file="molid663607_addedge_7_14_label_2.gxl" class="1"/>
	<graph file="molid663607_addnode_Pd.gxl" class="1"/>
	<graph file="molid663607_subnode_7_to_Hg.gxl" class="1"/>
	<graph file="molid663607_addnode_Au.gxl" class="1"/>
	<graph file="molid663607_subnode_9_to_P.gxl" class="1"/>
	<graph file="molid663607_subnode_13_to_Hg.gxl" class="1"/>
	<graph file="molid663607_subnode_5_to_B.gxl" class="1"/>
	<graph file="molid663607_subnode_5_to_Ho.gxl" class="1"/>
	<graph file="molid663607_subnode_14_to_P.gxl" class="1"/>
	<graph file="molid663607_subnode_1_to_Sb.gxl" class="1"/>
	<graph file="molid663607_subnode_5_to_Cu.gxl" class="1"/>
	<graph file="molid663607_subnode_13_to_Pt.gxl" class="1"/>
	<graph file="molid663607_addedge_1_14_label_1.gxl" class="1"/>
	<graph file="molid663607_subedge_2_7_to_1.gxl" class="1"/>
	<graph file="molid663607_subnode_6_to_Mg.gxl" class="1"/>
	<graph file="molid663607_subnode_0_to_Ga.gxl" class="1"/>
	<graph file="molid663607_subnode_6_to_Sb.gxl" class="1"/>
	<graph file="molid663607_subnode_0_to_F.gxl" class="1"/>
	<graph file="molid663607_addnode_N.gxl" class="1"/>
	<graph file="molid663607_subnode_5_to_Ga.gxl" class="1"/>
	<graph file="molid663607_addedge_3_9_label_1.gxl" class="1"/>
	<graph file="molid663607_subnode_3_to_Pb.gxl" class="1"/>
	<graph file="molid663607_addedge_1_31_label_2.gxl" class="1"/>
	<graph file="molid663607_addedge_6_31_label_2.gxl" class="1"/>
	<graph file="molid663607_addedge_13_15_label_2.gxl" class="1"/>
	<graph file="molid663607_subnode_6_to_N.gxl" class="1"/>
	<graph file="molid663607_subnode_5_to_W.gxl" class="1"/>
	<graph file="molid663607_subnode_7_to_Cu.gxl" class="1"/>
	<graph file="molid663607_addnode_Rh.gxl" class="1"/>
	<graph file="molid663607_subnode_14_to_Sb.gxl" class="1"/>
	<graph file="molid663607_subnode_1_to_Sn.gxl" class="1"/>
	<graph file="molid663607_subnode_5_to_Si.gxl" class="1"/>
	<graph file="molid663607_subnode_7_to_Br.gxl" class="1"/>
	<graph file="molid663607_subedge_30_31_to_2.gxl" class="1"/>
	<graph file="molid663607_subnode_13_to_Sb.gxl" class="1"/>
	<graph file="molid663607_addedge_1_3_label_2.gxl" class="1"/>
	<graph file="molid663607_subnode_7_to_K.gxl" class="1"/>
	<graph file="molid663607_subnode_3_to_Sb.gxl" class="1"/>
	<graph file="molid663607_addedge_9_15_label_1.gxl" class="1"/>
	<graph file="molid663607_subnode_7_to_C.gxl" class="1"/>
	<graph file="molid663607_subnode_14_to_Te.gxl" class="1"/>
	<graph file="molid663607_subnode_1_to_P.gxl" class="1"/>
	<graph file="molid663607_addnode_Li.gxl" class="1"/>
	<graph file="molid663607_subnode_13_to_B.gxl" class="1"/>
	<graph file="molid663607_subnode_1_to_Bi.gxl" class="1"/>
	<graph file="molid663607_subedge_12_14_to_2.gxl" class="1"/>
	<graph file="molid663607_deledge_30_31.gxl" class="1"/>
	<graph file="molid663607_subnode_10_to_Rh.gxl" class="1"/>
	<graph file="molid663607_subnode_1_to_Hg.gxl" class="1"/>
	<graph file="molid663607_subnode_13_to_I.gxl" class="1"/>
	<graph file="molid663607_addedge_5_14_label_1.gxl" class="1"/>
	<graph file="molid663607_subnode_6_to_Ho.gxl" class="1"/>
	<graph file="molid663607_subnode_5_to_S.gxl" class="1"/>
	<graph file="molid663607_subnode_5_to_Ni.gxl" class="1"/>
	<graph file="molid663607_subnode_14_to_Br.gxl" class="1"/>
	<graph file="molid663607_subnode_0_to_Pd.gxl" class="1"/>
	<graph file="molid663607_subnode_0_to_Zn.gxl" class="1"/>
	<graph file="molid663607_subnode_10_to_Hg.gxl" class="1"/>
	<graph file="molid663607_subnode_6_to_Br.gxl" class="1"/>
	<graph file="molid663607_subnode_14_to_Ga.gxl" class="1"/>
	<graph file="molid663607_subnode_1_to_Ni.gxl" class="1"/>
	<graph file="molid663607_subnode_14_to_W.gxl" class="1"/>
	<graph file="molid663607_subnode_1_to_Pd.gxl" class="1"/>
	<graph file="molid663607_subnode_13_to_Se.gxl" class="1"/>
	<graph file="molid663607_subnode_9_to_Ho.gxl" class="1"/>
	<graph file="molid663607_subnode_0_to_Bi.gxl" class="1"/>
	<graph file="molid663607_subnode_3_to_Cu.gxl" class="1"/>
	<graph file="molid663607_addedge_9_11_label_1.gxl" class="1"/>
	<graph file="molid663607_subnode_3_to_Br.gxl" class="1"/>
	<graph file="molid663607_subnode_13_to_F.gxl" class="1"/>
	<graph file="molid663607_addedge_7_13_label_2.gxl" class="1"/>
	<graph file="molid663607_addedge_5_10_label_2.gxl" class="1"/>
	<graph file="molid663607_addedge_10_14_label_2.gxl" class="1"/>
	<graph file="molid663607_subnode_9_to_Hg.gxl" class="1"/>
	<graph file="molid663607_subedge_17_19_to_2.gxl" class="1"/>
	<graph file="molid663607_subnode_0_to_Cu.gxl" class="1"/>
	<graph file="molid663607_addedge_0_9_label_1.gxl" class="1"/>
	<graph file="molid663607_subnode_0_to_P.gxl" class="1"/>
	<graph file="molid663607_subnode_3_to_P.gxl" class="1"/>
	<graph file="molid663607_subnode_5_to_Pb.gxl" class="1"/>
	<graph file="molid663607_subnode_6_to_F.gxl" class="1"/>
	<graph file="molid663607_addedge_0_6_label_2.gxl" class="1"/>
	<graph file="molid663607_addedge_6_14_label_1.gxl" class="1"/>
	<graph file="molid663607_subnode_6_to_O.gxl" class="1"/>
	<graph file="molid663607_subnode_9_to_Au.gxl" class="1"/>
	<graph file="molid663607_addedge_10_14_label_1.gxl" class="1"/>
	<graph file="molid663607_addedge_5_10_label_1.gxl" class="1"/>
	<graph file="molid663607_subnode_14_to_Tb.gxl" class="1"/>
	<graph file="molid663607_subnode_13_to_Pd.gxl" class="1"/>
	<graph file="molid663607_subnode_10_to_Co.gxl" class="1"/>
	<graph file="molid663607_deledge_5_9.gxl" class="1"/>
	<graph file="molid663607_deledge_17_19.gxl" class="1"/>
	<graph file="molid663607_subnode_9_to_Mg.gxl" class="1"/>
	<graph file="molid663607_subnode_6_to_Pb.gxl" class="1"/>
	<graph file="molid663607_subedge_0_1_to_1.gxl" class="1"/>
	<graph file="molid663607_subnode_0_to_B.gxl" class="1"/>
	<graph file="molid663607_subnode_1_to_Zn.gxl" class="1"/>
	<graph file="molid663607_addedge_3_14_label_1.gxl" class="1"/>
	<graph file="molid663607_subnode_10_to_Te.gxl" class="1"/>
	<graph file="molid663607_subnode_14_to_B.gxl" class="1"/>
	<graph file="molid663607_subnode_1_to_Ru.gxl" class="1"/>
	<graph file="molid663607_subnode_10_to_Zn.gxl" class="1"/>
	<graph file="molid663607_subnode_0_to_Br.gxl" class="1"/>
	<graph file="molid663607_subedge_15_16_to_2.gxl" class="1"/>
	<graph file="molid663607_subnode_3_to_Ru.gxl" class="1"/>
	<graph file="molid663607_addedge_0_6_label_1.gxl" class="1"/>
	<graph file="molid663607_subnode_3_to_Ho.gxl" class="1"/>
	<graph file="molid663607_addnode_As.gxl" class="1"/>
	<graph file="molid663607_subnode_13_to_Na.gxl" class="1"/>
	<graph file="molid663607_subedge_5_9_to_2.gxl" class="1"/>
	<graph file="molid663607_subnode_5_to_As.gxl" class="1"/>
	<graph file="molid663607_addedge_6_13_label_1.gxl" class="1"/>
	<graph file="molid663607_addedge_7_8_label_1.gxl" class="1"/>
	<graph file="molid663607_subnode_13_to_Co.gxl" class="1"/>
	<graph file="molid663607_addedge_1_9_label_2.gxl" class="1"/>
	<graph file="molid663607_subnode_13_to_Ho.gxl" class="1"/>
	<graph file="molid663607_subnode_9_to_Sb.gxl" class="1"/>
	<graph file="molid663607_subnode_9_to_Pt.gxl" class="1"/>
	<graph file="molid663607_addnode_Ho.gxl" class="1"/>
	<graph file="molid663607_addedge_7_9_label_2.gxl" class="1"/>
	<graph file="molid663607_subnode_0_to_O.gxl" class="1"/>
	<graph file="molid663607_subnode_7_to_Mg.gxl" class="1"/>
	<graph file="molid663607_subnode_1_to_B.gxl" class="1"/>
	<graph file="molid663607_subnode_14_to_Ge.gxl" class="1"/>
	<graph file="molid663607_subnode_9_to_B.gxl" class="1"/>
	<graph file="molid663607_subnode_13_to_K.gxl" class="1"/>
	<graph file="molid663607_subnode_9_to_Na.gxl" class="1"/>
	<graph file="molid663607_subnode_6_to_Li.gxl" class="1"/>
	<graph file="molid663607_addedge_9_15_label_2.gxl" class="1"/>
	<graph file="molid663607_subnode_1_to_Li.gxl" class="1"/>
	<graph file="molid663607_subnode_14_to_Au.gxl" class="1"/>
	<graph file="molid663607_subedge_4_5_to_2.gxl" class="1"/>
	<graph file="molid663607_subnode_6_to_Na.gxl" class="1"/>
	<graph file="molid663607_addedge_3_6_label_1.gxl" class="1"/>
	<graph file="molid663607_deledge_16_17.gxl" class="1"/>
	<graph file="molid663607_subnode_0_to_Ni.gxl" class="1"/>
	<graph file="molid663607_subnode_9_to_Pd.gxl" class="1"/>
	<graph file="molid663607_addnode_Cu.gxl" class="1"/>
	<graph file="molid663607_subnode_10_to_As.gxl" class="1"/>
	<graph file="molid663607_subnode_3_to_Na.gxl" class="1"/>
	<graph file="molid663607_addedge_0_13_label_2.gxl" class="1"/>
	<graph file="molid663607_addedge_3_10_label_1.gxl" class="1"/>
	<graph file="molid663607_subnode_1_to_Mg.gxl" class="1"/>
</GraphCollection>