<?xml version="1.0"?>
<!DOCTYPE GraphCollection SYSTEM "http://www.inf.unibz.it/~blumenthal/dtd/GraphCollection.dtd">
<GraphCollection>
	<graph file="molecule_2876.gxl" class="mutagen"/>
	<graph file="molecule_2746.gxl" class="mutagen"/>
	<graph file="molecule_1302.gxl" class="mutagen"/>
	<graph file="molecule_1179.gxl" class="mutagen"/>
	<graph file="molecule_4024.gxl" class="mutagen"/>
	<graph file="molecule_1394.gxl" class="mutagen"/>
	<graph file="molecule_1683.gxl" class="mutagen"/>
	<graph file="molecule_3682.gxl" class="mutagen"/>
	<graph file="molecule_830.gxl" class="mutagen"/>
	<graph file="molecule_1203.gxl" class="mutagen"/>
	<graph file="molecule_493.gxl" class="mutagen"/>
	<graph file="molecule_589.gxl" class="mutagen"/>
	<graph file="molecule_428.gxl" class="mutagen"/>
	<graph file="molecule_890.gxl" class="mutagen"/>
	<graph file="molecule_1381.gxl" class="mutagen"/>
	<graph file="molecule_615.gxl" class="mutagen"/>
	<graph file="molecule_3170.gxl" class="mutagen"/>
	<graph file="molecule_1342.gxl" class="mutagen"/>
	<graph file="molecule_3760.gxl" class="mutagen"/>
	<graph file="molecule_957.gxl" class="mutagen"/>
	<graph file="molecule_2561.gxl" class="mutagen"/>
	<graph file="molecule_2606.gxl" class="mutagen"/>
	<graph file="molecule_968.gxl" class="mutagen"/>
	<graph file="molecule_1952.gxl" class="mutagen"/>
	<graph file="molecule_1764.gxl" class="mutagen"/>
	<graph file="molecule_1086.gxl" class="nonmutagen"/>
	<graph file="molecule_461.gxl" class="nonmutagen"/>
	<graph file="molecule_2297.gxl" class="nonmutagen"/>
	<graph file="molecule_2224.gxl" class="nonmutagen"/>
	<graph file="molecule_4063.gxl" class="nonmutagen"/>
	<graph file="molecule_2169.gxl" class="nonmutagen"/>
	<graph file="molecule_3301.gxl" class="nonmutagen"/>
	<graph file="molecule_1464.gxl" class="nonmutagen"/>
	<graph file="molecule_2424.gxl" class="nonmutagen"/>
	<graph file="molecule_3483.gxl" class="nonmutagen"/>
	<graph file="molecule_4119.gxl" class="nonmutagen"/>
	<graph file="molecule_62.gxl" class="nonmutagen"/>
	<graph file="molecule_1507.gxl" class="nonmutagen"/>
	<graph file="molecule_803.gxl" class="nonmutagen"/>
	<graph file="molecule_4110.gxl" class="nonmutagen"/>
	<graph file="molecule_2651.gxl" class="nonmutagen"/>
	<graph file="molecule_1180.gxl" class="nonmutagen"/>
	<graph file="molecule_2575.gxl" class="nonmutagen"/>
	<graph file="molecule_1130.gxl" class="nonmutagen"/>
	<graph file="molecule_3816.gxl" class="nonmutagen"/>
	<graph file="molecule_3957.gxl" class="nonmutagen"/>
	<graph file="molecule_3501.gxl" class="nonmutagen"/>
	<graph file="molecule_132.gxl" class="nonmutagen"/>
	<graph file="molecule_3961.gxl" class="nonmutagen"/>
	<graph file="molecule_2782.gxl" class="nonmutagen"/>
</GraphCollection>