<?xml version="1.0"?>
<!DOCTYPE GraphCollection SYSTEM "http://www.inf.unibz.it/~blumenthal/dtd/GraphCollection.dtd">
<GraphCollection>
	<graph file="NP1_0050.gxl" class="N"/>
	<graph file="NP1_0051.gxl" class="N"/>
	<graph file="NP1_0052.gxl" class="N"/>
	<graph file="NP1_0053.gxl" class="N"/>
	<graph file="NP1_0054.gxl" class="N"/>
	<graph file="NP1_0055.gxl" class="N"/>
	<graph file="NP1_0056.gxl" class="N"/>
	<graph file="NP1_0057.gxl" class="N"/>
	<graph file="NP1_0058.gxl" class="N"/>
	<graph file="NP1_0059.gxl" class="N"/>
	<graph file="NP1_0060.gxl" class="N"/>
	<graph file="NP1_0061.gxl" class="N"/>
	<graph file="NP1_0062.gxl" class="N"/>
	<graph file="NP1_0063.gxl" class="N"/>
	<graph file="NP1_0064.gxl" class="N"/>
	<graph file="NP1_0065.gxl" class="N"/>
	<graph file="NP1_0066.gxl" class="N"/>
	<graph file="NP1_0067.gxl" class="N"/>
	<graph file="NP1_0068.gxl" class="N"/>
	<graph file="NP1_0069.gxl" class="N"/>
	<graph file="NP1_0070.gxl" class="N"/>
	<graph file="NP1_0071.gxl" class="N"/>
	<graph file="NP1_0072.gxl" class="N"/>
	<graph file="NP1_0073.gxl" class="N"/>
	<graph file="NP1_0074.gxl" class="N"/>
	<graph file="NP1_0075.gxl" class="N"/>
	<graph file="NP1_0076.gxl" class="N"/>
	<graph file="NP1_0077.gxl" class="N"/>
	<graph file="NP1_0078.gxl" class="N"/>
	<graph file="NP1_0079.gxl" class="N"/>
	<graph file="NP1_0080.gxl" class="N"/>
	<graph file="NP1_0081.gxl" class="N"/>
	<graph file="NP1_0082.gxl" class="N"/>
	<graph file="NP1_0083.gxl" class="N"/>
	<graph file="NP1_0084.gxl" class="N"/>
	<graph file="NP1_0085.gxl" class="N"/>
	<graph file="NP1_0086.gxl" class="N"/>
	<graph file="NP1_0087.gxl" class="N"/>
	<graph file="NP1_0088.gxl" class="N"/>
	<graph file="NP1_0089.gxl" class="N"/>
	<graph file="NP1_0090.gxl" class="N"/>
	<graph file="NP1_0091.gxl" class="N"/>
	<graph file="NP1_0092.gxl" class="N"/>
	<graph file="NP1_0093.gxl" class="N"/>
	<graph file="NP1_0094.gxl" class="N"/>
	<graph file="NP1_0095.gxl" class="N"/>
	<graph file="NP1_0096.gxl" class="N"/>
	<graph file="NP1_0097.gxl" class="N"/>
	<graph file="NP1_0098.gxl" class="N"/>
	<graph file="NP1_0099.gxl" class="N"/>
	<graph file="NP1_0000.gxl" class="N"/>
	<graph file="NP1_0001.gxl" class="N"/>
	<graph file="NP1_0002.gxl" class="N"/>
	<graph file="NP1_0003.gxl" class="N"/>
	<graph file="NP1_0004.gxl" class="N"/>
	<graph file="NP1_0005.gxl" class="N"/>
	<graph file="NP1_0006.gxl" class="N"/>
	<graph file="NP1_0007.gxl" class="N"/>
	<graph file="NP1_0008.gxl" class="N"/>
	<graph file="NP1_0009.gxl" class="N"/>
	<graph file="NP1_0010.gxl" class="N"/>
	<graph file="NP1_0011.gxl" class="N"/>
	<graph file="NP1_0012.gxl" class="N"/>
	<graph file="NP1_0013.gxl" class="N"/>
	<graph file="NP1_0014.gxl" class="N"/>
	<graph file="NP1_0015.gxl" class="N"/>
	<graph file="NP1_0016.gxl" class="N"/>
	<graph file="NP1_0017.gxl" class="N"/>
	<graph file="NP1_0018.gxl" class="N"/>
	<graph file="NP1_0019.gxl" class="N"/>
	<graph file="NP1_0020.gxl" class="N"/>
	<graph file="NP1_0021.gxl" class="N"/>
	<graph file="NP1_0022.gxl" class="N"/>
	<graph file="NP1_0023.gxl" class="N"/>
	<graph file="NP1_0024.gxl" class="N"/>
	<graph file="NP1_0025.gxl" class="N"/>
	<graph file="NP1_0026.gxl" class="N"/>
	<graph file="NP1_0027.gxl" class="N"/>
	<graph file="NP1_0028.gxl" class="N"/>
	<graph file="NP1_0029.gxl" class="N"/>
	<graph file="NP1_0030.gxl" class="N"/>
	<graph file="NP1_0031.gxl" class="N"/>
	<graph file="NP1_0032.gxl" class="N"/>
	<graph file="NP1_0033.gxl" class="N"/>
	<graph file="NP1_0034.gxl" class="N"/>
	<graph file="NP1_0035.gxl" class="N"/>
	<graph file="NP1_0036.gxl" class="N"/>
	<graph file="NP1_0037.gxl" class="N"/>
	<graph file="NP1_0038.gxl" class="N"/>
	<graph file="NP1_0039.gxl" class="N"/>
	<graph file="NP1_0040.gxl" class="N"/>
	<graph file="NP1_0041.gxl" class="N"/>
	<graph file="NP1_0042.gxl" class="N"/>
	<graph file="NP1_0043.gxl" class="N"/>
	<graph file="NP1_0044.gxl" class="N"/>
	<graph file="NP1_0045.gxl" class="N"/>
	<graph file="NP1_0046.gxl" class="N"/>
	<graph file="NP1_0047.gxl" class="N"/>
	<graph file="NP1_0048.gxl" class="N"/>
	<graph file="NP1_0049.gxl" class="N"/>
	<graph file="NP1_0100.gxl" class="N"/>
	<graph file="NP1_0101.gxl" class="N"/>
	<graph file="NP1_0102.gxl" class="N"/>
	<graph file="NP1_0103.gxl" class="N"/>
	<graph file="NP1_0104.gxl" class="N"/>
	<graph file="NP1_0105.gxl" class="N"/>
	<graph file="NP1_0106.gxl" class="N"/>
	<graph file="NP1_0107.gxl" class="N"/>
	<graph file="NP1_0108.gxl" class="N"/>
	<graph file="NP1_0109.gxl" class="N"/>
	<graph file="NP1_0110.gxl" class="N"/>
	<graph file="NP1_0111.gxl" class="N"/>
	<graph file="NP1_0112.gxl" class="N"/>
	<graph file="NP1_0113.gxl" class="N"/>
	<graph file="NP1_0114.gxl" class="N"/>
	<graph file="NP1_0115.gxl" class="N"/>
	<graph file="NP1_0116.gxl" class="N"/>
	<graph file="NP1_0117.gxl" class="N"/>
	<graph file="NP1_0118.gxl" class="N"/>
	<graph file="NP1_0119.gxl" class="N"/>
	<graph file="NP1_0120.gxl" class="N"/>
	<graph file="NP1_0121.gxl" class="N"/>
	<graph file="NP1_0122.gxl" class="N"/>
	<graph file="NP1_0123.gxl" class="N"/>
	<graph file="NP1_0124.gxl" class="N"/>
	<graph file="NP1_0125.gxl" class="N"/>
	<graph file="NP1_0126.gxl" class="N"/>
	<graph file="NP1_0127.gxl" class="N"/>
	<graph file="NP1_0128.gxl" class="N"/>
	<graph file="NP1_0129.gxl" class="N"/>
	<graph file="NP1_0130.gxl" class="N"/>
	<graph file="NP1_0131.gxl" class="N"/>
	<graph file="NP1_0132.gxl" class="N"/>
	<graph file="NP1_0133.gxl" class="N"/>
	<graph file="NP1_0134.gxl" class="N"/>
	<graph file="NP1_0135.gxl" class="N"/>
	<graph file="NP1_0136.gxl" class="N"/>
	<graph file="NP1_0137.gxl" class="N"/>
	<graph file="NP1_0138.gxl" class="N"/>
	<graph file="NP1_0139.gxl" class="N"/>
	<graph file="NP1_0140.gxl" class="N"/>
	<graph file="NP1_0141.gxl" class="N"/>
	<graph file="NP1_0142.gxl" class="N"/>
	<graph file="NP1_0143.gxl" class="N"/>
	<graph file="NP1_0144.gxl" class="N"/>
	<graph file="NP1_0145.gxl" class="N"/>
	<graph file="NP1_0146.gxl" class="N"/>
	<graph file="NP1_0147.gxl" class="N"/>
	<graph file="NP1_0148.gxl" class="N"/>
	<graph file="NP1_0149.gxl" class="N"/>
</GraphCollection>
