<?xml version="1.0"?>
<!DOCTYPE GraphCollection SYSTEM "http://www.inf.unibz.it/~blumenthal/dtd/GraphCollection.dtd">
<GraphCollection>
	<graph file="WP1_0050.gxl" class="W"/>
	<graph file="WP1_0051.gxl" class="W"/>
	<graph file="WP1_0052.gxl" class="W"/>
	<graph file="WP1_0053.gxl" class="W"/>
	<graph file="WP1_0054.gxl" class="W"/>
	<graph file="WP1_0055.gxl" class="W"/>
	<graph file="WP1_0056.gxl" class="W"/>
	<graph file="WP1_0057.gxl" class="W"/>
	<graph file="WP1_0058.gxl" class="W"/>
	<graph file="WP1_0059.gxl" class="W"/>
	<graph file="WP1_0060.gxl" class="W"/>
	<graph file="WP1_0061.gxl" class="W"/>
	<graph file="WP1_0062.gxl" class="W"/>
	<graph file="WP1_0063.gxl" class="W"/>
	<graph file="WP1_0064.gxl" class="W"/>
	<graph file="WP1_0065.gxl" class="W"/>
	<graph file="WP1_0066.gxl" class="W"/>
	<graph file="WP1_0067.gxl" class="W"/>
	<graph file="WP1_0068.gxl" class="W"/>
	<graph file="WP1_0069.gxl" class="W"/>
	<graph file="WP1_0070.gxl" class="W"/>
	<graph file="WP1_0071.gxl" class="W"/>
	<graph file="WP1_0072.gxl" class="W"/>
	<graph file="WP1_0073.gxl" class="W"/>
	<graph file="WP1_0074.gxl" class="W"/>
	<graph file="WP1_0075.gxl" class="W"/>
	<graph file="WP1_0076.gxl" class="W"/>
	<graph file="WP1_0077.gxl" class="W"/>
	<graph file="WP1_0078.gxl" class="W"/>
	<graph file="WP1_0079.gxl" class="W"/>
	<graph file="WP1_0080.gxl" class="W"/>
	<graph file="WP1_0081.gxl" class="W"/>
	<graph file="WP1_0082.gxl" class="W"/>
	<graph file="WP1_0083.gxl" class="W"/>
	<graph file="WP1_0084.gxl" class="W"/>
	<graph file="WP1_0085.gxl" class="W"/>
	<graph file="WP1_0086.gxl" class="W"/>
	<graph file="WP1_0087.gxl" class="W"/>
	<graph file="WP1_0088.gxl" class="W"/>
	<graph file="WP1_0089.gxl" class="W"/>
	<graph file="WP1_0090.gxl" class="W"/>
	<graph file="WP1_0091.gxl" class="W"/>
	<graph file="WP1_0092.gxl" class="W"/>
	<graph file="WP1_0093.gxl" class="W"/>
	<graph file="WP1_0094.gxl" class="W"/>
	<graph file="WP1_0095.gxl" class="W"/>
	<graph file="WP1_0096.gxl" class="W"/>
	<graph file="WP1_0097.gxl" class="W"/>
	<graph file="WP1_0098.gxl" class="W"/>
	<graph file="WP1_0099.gxl" class="W"/>
	<graph file="WP1_0000.gxl" class="W"/>
	<graph file="WP1_0001.gxl" class="W"/>
	<graph file="WP1_0002.gxl" class="W"/>
	<graph file="WP1_0003.gxl" class="W"/>
	<graph file="WP1_0004.gxl" class="W"/>
	<graph file="WP1_0005.gxl" class="W"/>
	<graph file="WP1_0006.gxl" class="W"/>
	<graph file="WP1_0007.gxl" class="W"/>
	<graph file="WP1_0008.gxl" class="W"/>
	<graph file="WP1_0009.gxl" class="W"/>
	<graph file="WP1_0010.gxl" class="W"/>
	<graph file="WP1_0011.gxl" class="W"/>
	<graph file="WP1_0012.gxl" class="W"/>
	<graph file="WP1_0013.gxl" class="W"/>
	<graph file="WP1_0014.gxl" class="W"/>
	<graph file="WP1_0015.gxl" class="W"/>
	<graph file="WP1_0016.gxl" class="W"/>
	<graph file="WP1_0017.gxl" class="W"/>
	<graph file="WP1_0018.gxl" class="W"/>
	<graph file="WP1_0019.gxl" class="W"/>
	<graph file="WP1_0020.gxl" class="W"/>
	<graph file="WP1_0021.gxl" class="W"/>
	<graph file="WP1_0022.gxl" class="W"/>
	<graph file="WP1_0023.gxl" class="W"/>
	<graph file="WP1_0024.gxl" class="W"/>
	<graph file="WP1_0025.gxl" class="W"/>
	<graph file="WP1_0026.gxl" class="W"/>
	<graph file="WP1_0027.gxl" class="W"/>
	<graph file="WP1_0028.gxl" class="W"/>
	<graph file="WP1_0029.gxl" class="W"/>
	<graph file="WP1_0030.gxl" class="W"/>
	<graph file="WP1_0031.gxl" class="W"/>
	<graph file="WP1_0032.gxl" class="W"/>
	<graph file="WP1_0033.gxl" class="W"/>
	<graph file="WP1_0034.gxl" class="W"/>
	<graph file="WP1_0035.gxl" class="W"/>
	<graph file="WP1_0036.gxl" class="W"/>
	<graph file="WP1_0037.gxl" class="W"/>
	<graph file="WP1_0038.gxl" class="W"/>
	<graph file="WP1_0039.gxl" class="W"/>
	<graph file="WP1_0040.gxl" class="W"/>
	<graph file="WP1_0041.gxl" class="W"/>
	<graph file="WP1_0042.gxl" class="W"/>
	<graph file="WP1_0043.gxl" class="W"/>
	<graph file="WP1_0044.gxl" class="W"/>
	<graph file="WP1_0045.gxl" class="W"/>
	<graph file="WP1_0046.gxl" class="W"/>
	<graph file="WP1_0047.gxl" class="W"/>
	<graph file="WP1_0048.gxl" class="W"/>
	<graph file="WP1_0049.gxl" class="W"/>
	<graph file="WP1_0100.gxl" class="W"/>
	<graph file="WP1_0101.gxl" class="W"/>
	<graph file="WP1_0102.gxl" class="W"/>
	<graph file="WP1_0103.gxl" class="W"/>
	<graph file="WP1_0104.gxl" class="W"/>
	<graph file="WP1_0105.gxl" class="W"/>
	<graph file="WP1_0106.gxl" class="W"/>
	<graph file="WP1_0107.gxl" class="W"/>
	<graph file="WP1_0108.gxl" class="W"/>
	<graph file="WP1_0109.gxl" class="W"/>
	<graph file="WP1_0110.gxl" class="W"/>
	<graph file="WP1_0111.gxl" class="W"/>
	<graph file="WP1_0112.gxl" class="W"/>
	<graph file="WP1_0113.gxl" class="W"/>
	<graph file="WP1_0114.gxl" class="W"/>
	<graph file="WP1_0115.gxl" class="W"/>
	<graph file="WP1_0116.gxl" class="W"/>
	<graph file="WP1_0117.gxl" class="W"/>
	<graph file="WP1_0118.gxl" class="W"/>
	<graph file="WP1_0119.gxl" class="W"/>
	<graph file="WP1_0120.gxl" class="W"/>
	<graph file="WP1_0121.gxl" class="W"/>
	<graph file="WP1_0122.gxl" class="W"/>
	<graph file="WP1_0123.gxl" class="W"/>
	<graph file="WP1_0124.gxl" class="W"/>
	<graph file="WP1_0125.gxl" class="W"/>
	<graph file="WP1_0126.gxl" class="W"/>
	<graph file="WP1_0127.gxl" class="W"/>
	<graph file="WP1_0128.gxl" class="W"/>
	<graph file="WP1_0129.gxl" class="W"/>
	<graph file="WP1_0130.gxl" class="W"/>
	<graph file="WP1_0131.gxl" class="W"/>
	<graph file="WP1_0132.gxl" class="W"/>
	<graph file="WP1_0133.gxl" class="W"/>
	<graph file="WP1_0134.gxl" class="W"/>
	<graph file="WP1_0135.gxl" class="W"/>
	<graph file="WP1_0136.gxl" class="W"/>
	<graph file="WP1_0137.gxl" class="W"/>
	<graph file="WP1_0138.gxl" class="W"/>
	<graph file="WP1_0139.gxl" class="W"/>
	<graph file="WP1_0140.gxl" class="W"/>
	<graph file="WP1_0141.gxl" class="W"/>
	<graph file="WP1_0142.gxl" class="W"/>
	<graph file="WP1_0143.gxl" class="W"/>
	<graph file="WP1_0144.gxl" class="W"/>
	<graph file="WP1_0145.gxl" class="W"/>
	<graph file="WP1_0146.gxl" class="W"/>
	<graph file="WP1_0147.gxl" class="W"/>
	<graph file="WP1_0148.gxl" class="W"/>
	<graph file="WP1_0149.gxl" class="W"/>
</GraphCollection>
