<?xml version="1.0"?>
<!DOCTYPE GraphCollection SYSTEM "http://www.inf.unibz.it/~blumenthal/dtd/GraphCollection.dtd">
<GraphCollection>
	<graph file="XP1_0050.gxl" class="X"/>
	<graph file="XP1_0051.gxl" class="X"/>
	<graph file="XP1_0052.gxl" class="X"/>
	<graph file="XP1_0053.gxl" class="X"/>
	<graph file="XP1_0054.gxl" class="X"/>
	<graph file="XP1_0055.gxl" class="X"/>
	<graph file="XP1_0056.gxl" class="X"/>
	<graph file="XP1_0057.gxl" class="X"/>
	<graph file="XP1_0058.gxl" class="X"/>
	<graph file="XP1_0059.gxl" class="X"/>
	<graph file="XP1_0060.gxl" class="X"/>
	<graph file="XP1_0061.gxl" class="X"/>
	<graph file="XP1_0062.gxl" class="X"/>
	<graph file="XP1_0063.gxl" class="X"/>
	<graph file="XP1_0064.gxl" class="X"/>
	<graph file="XP1_0065.gxl" class="X"/>
	<graph file="XP1_0066.gxl" class="X"/>
	<graph file="XP1_0067.gxl" class="X"/>
	<graph file="XP1_0068.gxl" class="X"/>
	<graph file="XP1_0069.gxl" class="X"/>
	<graph file="XP1_0070.gxl" class="X"/>
	<graph file="XP1_0071.gxl" class="X"/>
	<graph file="XP1_0072.gxl" class="X"/>
	<graph file="XP1_0073.gxl" class="X"/>
	<graph file="XP1_0074.gxl" class="X"/>
	<graph file="XP1_0075.gxl" class="X"/>
	<graph file="XP1_0076.gxl" class="X"/>
	<graph file="XP1_0077.gxl" class="X"/>
	<graph file="XP1_0078.gxl" class="X"/>
	<graph file="XP1_0079.gxl" class="X"/>
	<graph file="XP1_0080.gxl" class="X"/>
	<graph file="XP1_0081.gxl" class="X"/>
	<graph file="XP1_0082.gxl" class="X"/>
	<graph file="XP1_0083.gxl" class="X"/>
	<graph file="XP1_0084.gxl" class="X"/>
	<graph file="XP1_0085.gxl" class="X"/>
	<graph file="XP1_0086.gxl" class="X"/>
	<graph file="XP1_0087.gxl" class="X"/>
	<graph file="XP1_0088.gxl" class="X"/>
	<graph file="XP1_0089.gxl" class="X"/>
	<graph file="XP1_0090.gxl" class="X"/>
	<graph file="XP1_0091.gxl" class="X"/>
	<graph file="XP1_0092.gxl" class="X"/>
	<graph file="XP1_0093.gxl" class="X"/>
	<graph file="XP1_0094.gxl" class="X"/>
	<graph file="XP1_0095.gxl" class="X"/>
	<graph file="XP1_0096.gxl" class="X"/>
	<graph file="XP1_0097.gxl" class="X"/>
	<graph file="XP1_0098.gxl" class="X"/>
	<graph file="XP1_0099.gxl" class="X"/>
	<graph file="XP1_0000.gxl" class="X"/>
	<graph file="XP1_0001.gxl" class="X"/>
	<graph file="XP1_0002.gxl" class="X"/>
	<graph file="XP1_0003.gxl" class="X"/>
	<graph file="XP1_0004.gxl" class="X"/>
	<graph file="XP1_0005.gxl" class="X"/>
	<graph file="XP1_0006.gxl" class="X"/>
	<graph file="XP1_0007.gxl" class="X"/>
	<graph file="XP1_0008.gxl" class="X"/>
	<graph file="XP1_0009.gxl" class="X"/>
	<graph file="XP1_0010.gxl" class="X"/>
	<graph file="XP1_0011.gxl" class="X"/>
	<graph file="XP1_0012.gxl" class="X"/>
	<graph file="XP1_0013.gxl" class="X"/>
	<graph file="XP1_0014.gxl" class="X"/>
	<graph file="XP1_0015.gxl" class="X"/>
	<graph file="XP1_0016.gxl" class="X"/>
	<graph file="XP1_0017.gxl" class="X"/>
	<graph file="XP1_0018.gxl" class="X"/>
	<graph file="XP1_0019.gxl" class="X"/>
	<graph file="XP1_0020.gxl" class="X"/>
	<graph file="XP1_0021.gxl" class="X"/>
	<graph file="XP1_0022.gxl" class="X"/>
	<graph file="XP1_0023.gxl" class="X"/>
	<graph file="XP1_0024.gxl" class="X"/>
	<graph file="XP1_0025.gxl" class="X"/>
	<graph file="XP1_0026.gxl" class="X"/>
	<graph file="XP1_0027.gxl" class="X"/>
	<graph file="XP1_0028.gxl" class="X"/>
	<graph file="XP1_0029.gxl" class="X"/>
	<graph file="XP1_0030.gxl" class="X"/>
	<graph file="XP1_0031.gxl" class="X"/>
	<graph file="XP1_0032.gxl" class="X"/>
	<graph file="XP1_0033.gxl" class="X"/>
	<graph file="XP1_0034.gxl" class="X"/>
	<graph file="XP1_0035.gxl" class="X"/>
	<graph file="XP1_0036.gxl" class="X"/>
	<graph file="XP1_0037.gxl" class="X"/>
	<graph file="XP1_0038.gxl" class="X"/>
	<graph file="XP1_0039.gxl" class="X"/>
	<graph file="XP1_0040.gxl" class="X"/>
	<graph file="XP1_0041.gxl" class="X"/>
	<graph file="XP1_0042.gxl" class="X"/>
	<graph file="XP1_0043.gxl" class="X"/>
	<graph file="XP1_0044.gxl" class="X"/>
	<graph file="XP1_0045.gxl" class="X"/>
	<graph file="XP1_0046.gxl" class="X"/>
	<graph file="XP1_0047.gxl" class="X"/>
	<graph file="XP1_0048.gxl" class="X"/>
	<graph file="XP1_0049.gxl" class="X"/>
	<graph file="XP1_0100.gxl" class="X"/>
	<graph file="XP1_0101.gxl" class="X"/>
	<graph file="XP1_0102.gxl" class="X"/>
	<graph file="XP1_0103.gxl" class="X"/>
	<graph file="XP1_0104.gxl" class="X"/>
	<graph file="XP1_0105.gxl" class="X"/>
	<graph file="XP1_0106.gxl" class="X"/>
	<graph file="XP1_0107.gxl" class="X"/>
	<graph file="XP1_0108.gxl" class="X"/>
	<graph file="XP1_0109.gxl" class="X"/>
	<graph file="XP1_0110.gxl" class="X"/>
	<graph file="XP1_0111.gxl" class="X"/>
	<graph file="XP1_0112.gxl" class="X"/>
	<graph file="XP1_0113.gxl" class="X"/>
	<graph file="XP1_0114.gxl" class="X"/>
	<graph file="XP1_0115.gxl" class="X"/>
	<graph file="XP1_0116.gxl" class="X"/>
	<graph file="XP1_0117.gxl" class="X"/>
	<graph file="XP1_0118.gxl" class="X"/>
	<graph file="XP1_0119.gxl" class="X"/>
	<graph file="XP1_0120.gxl" class="X"/>
	<graph file="XP1_0121.gxl" class="X"/>
	<graph file="XP1_0122.gxl" class="X"/>
	<graph file="XP1_0123.gxl" class="X"/>
	<graph file="XP1_0124.gxl" class="X"/>
	<graph file="XP1_0125.gxl" class="X"/>
	<graph file="XP1_0126.gxl" class="X"/>
	<graph file="XP1_0127.gxl" class="X"/>
	<graph file="XP1_0128.gxl" class="X"/>
	<graph file="XP1_0129.gxl" class="X"/>
	<graph file="XP1_0130.gxl" class="X"/>
	<graph file="XP1_0131.gxl" class="X"/>
	<graph file="XP1_0132.gxl" class="X"/>
	<graph file="XP1_0133.gxl" class="X"/>
	<graph file="XP1_0134.gxl" class="X"/>
	<graph file="XP1_0135.gxl" class="X"/>
	<graph file="XP1_0136.gxl" class="X"/>
	<graph file="XP1_0137.gxl" class="X"/>
	<graph file="XP1_0138.gxl" class="X"/>
	<graph file="XP1_0139.gxl" class="X"/>
	<graph file="XP1_0140.gxl" class="X"/>
	<graph file="XP1_0141.gxl" class="X"/>
	<graph file="XP1_0142.gxl" class="X"/>
	<graph file="XP1_0143.gxl" class="X"/>
	<graph file="XP1_0144.gxl" class="X"/>
	<graph file="XP1_0145.gxl" class="X"/>
	<graph file="XP1_0146.gxl" class="X"/>
	<graph file="XP1_0147.gxl" class="X"/>
	<graph file="XP1_0148.gxl" class="X"/>
	<graph file="XP1_0149.gxl" class="X"/>
</GraphCollection>
