<?xml version="1.0"?>
<!DOCTYPE GraphCollection SYSTEM "http://www.inf.unibz.it/~blumenthal/dtd/GraphCollection.dtd">
<GraphCollection>
	<graph file="AP1_0050.gxl" class="A"/>
	<graph file="AP1_0051.gxl" class="A"/>
	<graph file="AP1_0052.gxl" class="A"/>
	<graph file="AP1_0053.gxl" class="A"/>
	<graph file="AP1_0054.gxl" class="A"/>
	<graph file="AP1_0055.gxl" class="A"/>
	<graph file="AP1_0056.gxl" class="A"/>
	<graph file="AP1_0057.gxl" class="A"/>
	<graph file="AP1_0058.gxl" class="A"/>
	<graph file="AP1_0059.gxl" class="A"/>
	<graph file="AP1_0060.gxl" class="A"/>
	<graph file="AP1_0061.gxl" class="A"/>
	<graph file="AP1_0062.gxl" class="A"/>
	<graph file="AP1_0063.gxl" class="A"/>
	<graph file="AP1_0064.gxl" class="A"/>
	<graph file="AP1_0065.gxl" class="A"/>
	<graph file="AP1_0066.gxl" class="A"/>
	<graph file="AP1_0067.gxl" class="A"/>
	<graph file="AP1_0068.gxl" class="A"/>
	<graph file="AP1_0069.gxl" class="A"/>
	<graph file="AP1_0070.gxl" class="A"/>
	<graph file="AP1_0071.gxl" class="A"/>
	<graph file="AP1_0072.gxl" class="A"/>
	<graph file="AP1_0073.gxl" class="A"/>
	<graph file="AP1_0074.gxl" class="A"/>
	<graph file="AP1_0075.gxl" class="A"/>
	<graph file="AP1_0076.gxl" class="A"/>
	<graph file="AP1_0077.gxl" class="A"/>
	<graph file="AP1_0078.gxl" class="A"/>
	<graph file="AP1_0079.gxl" class="A"/>
	<graph file="AP1_0080.gxl" class="A"/>
	<graph file="AP1_0081.gxl" class="A"/>
	<graph file="AP1_0082.gxl" class="A"/>
	<graph file="AP1_0083.gxl" class="A"/>
	<graph file="AP1_0084.gxl" class="A"/>
	<graph file="AP1_0085.gxl" class="A"/>
	<graph file="AP1_0086.gxl" class="A"/>
	<graph file="AP1_0087.gxl" class="A"/>
	<graph file="AP1_0088.gxl" class="A"/>
	<graph file="AP1_0089.gxl" class="A"/>
	<graph file="AP1_0090.gxl" class="A"/>
	<graph file="AP1_0091.gxl" class="A"/>
	<graph file="AP1_0092.gxl" class="A"/>
	<graph file="AP1_0093.gxl" class="A"/>
	<graph file="AP1_0094.gxl" class="A"/>
	<graph file="AP1_0095.gxl" class="A"/>
	<graph file="AP1_0096.gxl" class="A"/>
	<graph file="AP1_0097.gxl" class="A"/>
	<graph file="AP1_0098.gxl" class="A"/>
	<graph file="AP1_0099.gxl" class="A"/>
	<graph file="AP1_0000.gxl" class="A"/>
	<graph file="AP1_0001.gxl" class="A"/>
	<graph file="AP1_0002.gxl" class="A"/>
	<graph file="AP1_0003.gxl" class="A"/>
	<graph file="AP1_0004.gxl" class="A"/>
	<graph file="AP1_0005.gxl" class="A"/>
	<graph file="AP1_0006.gxl" class="A"/>
	<graph file="AP1_0007.gxl" class="A"/>
	<graph file="AP1_0008.gxl" class="A"/>
	<graph file="AP1_0009.gxl" class="A"/>
	<graph file="AP1_0010.gxl" class="A"/>
	<graph file="AP1_0011.gxl" class="A"/>
	<graph file="AP1_0012.gxl" class="A"/>
	<graph file="AP1_0013.gxl" class="A"/>
	<graph file="AP1_0014.gxl" class="A"/>
	<graph file="AP1_0015.gxl" class="A"/>
	<graph file="AP1_0016.gxl" class="A"/>
	<graph file="AP1_0017.gxl" class="A"/>
	<graph file="AP1_0018.gxl" class="A"/>
	<graph file="AP1_0019.gxl" class="A"/>
	<graph file="AP1_0020.gxl" class="A"/>
	<graph file="AP1_0021.gxl" class="A"/>
	<graph file="AP1_0022.gxl" class="A"/>
	<graph file="AP1_0023.gxl" class="A"/>
	<graph file="AP1_0024.gxl" class="A"/>
	<graph file="AP1_0025.gxl" class="A"/>
	<graph file="AP1_0026.gxl" class="A"/>
	<graph file="AP1_0027.gxl" class="A"/>
	<graph file="AP1_0028.gxl" class="A"/>
	<graph file="AP1_0029.gxl" class="A"/>
	<graph file="AP1_0030.gxl" class="A"/>
	<graph file="AP1_0031.gxl" class="A"/>
	<graph file="AP1_0032.gxl" class="A"/>
	<graph file="AP1_0033.gxl" class="A"/>
	<graph file="AP1_0034.gxl" class="A"/>
	<graph file="AP1_0035.gxl" class="A"/>
	<graph file="AP1_0036.gxl" class="A"/>
	<graph file="AP1_0037.gxl" class="A"/>
	<graph file="AP1_0038.gxl" class="A"/>
	<graph file="AP1_0039.gxl" class="A"/>
	<graph file="AP1_0040.gxl" class="A"/>
	<graph file="AP1_0041.gxl" class="A"/>
	<graph file="AP1_0042.gxl" class="A"/>
	<graph file="AP1_0043.gxl" class="A"/>
	<graph file="AP1_0044.gxl" class="A"/>
	<graph file="AP1_0045.gxl" class="A"/>
	<graph file="AP1_0046.gxl" class="A"/>
	<graph file="AP1_0047.gxl" class="A"/>
	<graph file="AP1_0048.gxl" class="A"/>
	<graph file="AP1_0049.gxl" class="A"/>
	<graph file="AP1_0100.gxl" class="A"/>
	<graph file="AP1_0101.gxl" class="A"/>
	<graph file="AP1_0102.gxl" class="A"/>
	<graph file="AP1_0103.gxl" class="A"/>
	<graph file="AP1_0104.gxl" class="A"/>
	<graph file="AP1_0105.gxl" class="A"/>
	<graph file="AP1_0106.gxl" class="A"/>
	<graph file="AP1_0107.gxl" class="A"/>
	<graph file="AP1_0108.gxl" class="A"/>
	<graph file="AP1_0109.gxl" class="A"/>
	<graph file="AP1_0110.gxl" class="A"/>
	<graph file="AP1_0111.gxl" class="A"/>
	<graph file="AP1_0112.gxl" class="A"/>
	<graph file="AP1_0113.gxl" class="A"/>
	<graph file="AP1_0114.gxl" class="A"/>
	<graph file="AP1_0115.gxl" class="A"/>
	<graph file="AP1_0116.gxl" class="A"/>
	<graph file="AP1_0117.gxl" class="A"/>
	<graph file="AP1_0118.gxl" class="A"/>
	<graph file="AP1_0119.gxl" class="A"/>
	<graph file="AP1_0120.gxl" class="A"/>
	<graph file="AP1_0121.gxl" class="A"/>
	<graph file="AP1_0122.gxl" class="A"/>
	<graph file="AP1_0123.gxl" class="A"/>
	<graph file="AP1_0124.gxl" class="A"/>
	<graph file="AP1_0125.gxl" class="A"/>
	<graph file="AP1_0126.gxl" class="A"/>
	<graph file="AP1_0127.gxl" class="A"/>
	<graph file="AP1_0128.gxl" class="A"/>
	<graph file="AP1_0129.gxl" class="A"/>
	<graph file="AP1_0130.gxl" class="A"/>
	<graph file="AP1_0131.gxl" class="A"/>
	<graph file="AP1_0132.gxl" class="A"/>
	<graph file="AP1_0133.gxl" class="A"/>
	<graph file="AP1_0134.gxl" class="A"/>
	<graph file="AP1_0135.gxl" class="A"/>
	<graph file="AP1_0136.gxl" class="A"/>
	<graph file="AP1_0137.gxl" class="A"/>
	<graph file="AP1_0138.gxl" class="A"/>
	<graph file="AP1_0139.gxl" class="A"/>
	<graph file="AP1_0140.gxl" class="A"/>
	<graph file="AP1_0141.gxl" class="A"/>
	<graph file="AP1_0142.gxl" class="A"/>
	<graph file="AP1_0143.gxl" class="A"/>
	<graph file="AP1_0144.gxl" class="A"/>
	<graph file="AP1_0145.gxl" class="A"/>
	<graph file="AP1_0146.gxl" class="A"/>
	<graph file="AP1_0147.gxl" class="A"/>
	<graph file="AP1_0148.gxl" class="A"/>
	<graph file="AP1_0149.gxl" class="A"/>
</GraphCollection>
