<?xml version="1.0"?>
<!DOCTYPE GraphCollection SYSTEM "http://www.inf.unibz.it/~blumenthal/dtd/GraphCollection.dtd">
<GraphCollection>
	<graph file="molecule001.gxl" class="a"/>
	<graph file="molecule002.gxl" class="a"/>
	<graph file="molecule003.gxl" class="a"/>
	<graph file="molecule004.gxl" class="a"/>
	<graph file="molecule005.gxl" class="a"/>
	<graph file="molecule006.gxl" class="a"/>
	<graph file="molecule007.gxl" class="a"/>
	<graph file="molecule008.gxl" class="a"/>
	<graph file="molecule009.gxl" class="a"/>
	<graph file="molecule010.gxl" class="a"/>
	<graph file="molecule011.gxl" class="a"/>
	<graph file="molecule012.gxl" class="a"/>
	<graph file="molecule013.gxl" class="a"/>
	<graph file="molecule014.gxl" class="a"/>
	<graph file="molecule015.gxl" class="a"/>
	<graph file="molecule016.gxl" class="a"/>
	<graph file="molecule017.gxl" class="a"/>
	<graph file="molecule018.gxl" class="a"/>
	<graph file="molecule019.gxl" class="a"/>
	<graph file="molecule020.gxl" class="a"/>
	<graph file="molecule021.gxl" class="a"/>
	<graph file="molecule022.gxl" class="a"/>
	<graph file="molecule023.gxl" class="a"/>
	<graph file="molecule024.gxl" class="a"/>
	<graph file="molecule025.gxl" class="a"/>
	<graph file="molecule026.gxl" class="a"/>
	<graph file="molecule027.gxl" class="a"/>
	<graph file="molecule028.gxl" class="a"/>
	<graph file="molecule029.gxl" class="a"/>
	<graph file="molecule030.gxl" class="a"/>
	<graph file="molecule031.gxl" class="a"/>
	<graph file="molecule032.gxl" class="a"/>
	<graph file="molecule033.gxl" class="a"/>
	<graph file="molecule034.gxl" class="a"/>
	<graph file="molecule035.gxl" class="a"/>
	<graph file="molecule036.gxl" class="a"/>
	<graph file="molecule037.gxl" class="a"/>
	<graph file="molecule038.gxl" class="a"/>
	<graph file="molecule039.gxl" class="a"/>
	<graph file="molecule040.gxl" class="a"/>
	<graph file="molecule041.gxl" class="a"/>
	<graph file="molecule042.gxl" class="a"/>
	<graph file="molecule043.gxl" class="a"/>
	<graph file="molecule044.gxl" class="a"/>
	<graph file="molecule045.gxl" class="a"/>
	<graph file="molecule046.gxl" class="a"/>
	<graph file="molecule047.gxl" class="a"/>
	<graph file="molecule048.gxl" class="a"/>
	<graph file="molecule049.gxl" class="a"/>
	<graph file="molecule050.gxl" class="a"/>
</GraphCollection>
