<?xml version="1.0"?>
<!DOCTYPE GraphCollection SYSTEM "http://www.inf.unibz.it/~blumenthal/dtd/GraphCollection.dtd">
<GraphCollection>
	<graph file="FP1_0050.gxl" class="F"/>
	<graph file="FP1_0051.gxl" class="F"/>
	<graph file="FP1_0052.gxl" class="F"/>
	<graph file="FP1_0053.gxl" class="F"/>
	<graph file="FP1_0054.gxl" class="F"/>
	<graph file="FP1_0055.gxl" class="F"/>
	<graph file="FP1_0056.gxl" class="F"/>
	<graph file="FP1_0057.gxl" class="F"/>
	<graph file="FP1_0058.gxl" class="F"/>
	<graph file="FP1_0059.gxl" class="F"/>
	<graph file="FP1_0060.gxl" class="F"/>
	<graph file="FP1_0061.gxl" class="F"/>
	<graph file="FP1_0062.gxl" class="F"/>
	<graph file="FP1_0063.gxl" class="F"/>
	<graph file="FP1_0064.gxl" class="F"/>
	<graph file="FP1_0065.gxl" class="F"/>
	<graph file="FP1_0066.gxl" class="F"/>
	<graph file="FP1_0067.gxl" class="F"/>
	<graph file="FP1_0068.gxl" class="F"/>
	<graph file="FP1_0069.gxl" class="F"/>
	<graph file="FP1_0070.gxl" class="F"/>
	<graph file="FP1_0071.gxl" class="F"/>
	<graph file="FP1_0072.gxl" class="F"/>
	<graph file="FP1_0073.gxl" class="F"/>
	<graph file="FP1_0074.gxl" class="F"/>
	<graph file="FP1_0075.gxl" class="F"/>
	<graph file="FP1_0076.gxl" class="F"/>
	<graph file="FP1_0077.gxl" class="F"/>
	<graph file="FP1_0078.gxl" class="F"/>
	<graph file="FP1_0079.gxl" class="F"/>
	<graph file="FP1_0080.gxl" class="F"/>
	<graph file="FP1_0081.gxl" class="F"/>
	<graph file="FP1_0082.gxl" class="F"/>
	<graph file="FP1_0083.gxl" class="F"/>
	<graph file="FP1_0084.gxl" class="F"/>
	<graph file="FP1_0085.gxl" class="F"/>
	<graph file="FP1_0086.gxl" class="F"/>
	<graph file="FP1_0087.gxl" class="F"/>
	<graph file="FP1_0088.gxl" class="F"/>
	<graph file="FP1_0089.gxl" class="F"/>
	<graph file="FP1_0090.gxl" class="F"/>
	<graph file="FP1_0091.gxl" class="F"/>
	<graph file="FP1_0092.gxl" class="F"/>
	<graph file="FP1_0093.gxl" class="F"/>
	<graph file="FP1_0094.gxl" class="F"/>
	<graph file="FP1_0095.gxl" class="F"/>
	<graph file="FP1_0096.gxl" class="F"/>
	<graph file="FP1_0097.gxl" class="F"/>
	<graph file="FP1_0098.gxl" class="F"/>
	<graph file="FP1_0099.gxl" class="F"/>
	<graph file="FP1_0000.gxl" class="F"/>
	<graph file="FP1_0001.gxl" class="F"/>
	<graph file="FP1_0002.gxl" class="F"/>
	<graph file="FP1_0003.gxl" class="F"/>
	<graph file="FP1_0004.gxl" class="F"/>
	<graph file="FP1_0005.gxl" class="F"/>
	<graph file="FP1_0006.gxl" class="F"/>
	<graph file="FP1_0007.gxl" class="F"/>
	<graph file="FP1_0008.gxl" class="F"/>
	<graph file="FP1_0009.gxl" class="F"/>
	<graph file="FP1_0010.gxl" class="F"/>
	<graph file="FP1_0011.gxl" class="F"/>
	<graph file="FP1_0012.gxl" class="F"/>
	<graph file="FP1_0013.gxl" class="F"/>
	<graph file="FP1_0014.gxl" class="F"/>
	<graph file="FP1_0015.gxl" class="F"/>
	<graph file="FP1_0016.gxl" class="F"/>
	<graph file="FP1_0017.gxl" class="F"/>
	<graph file="FP1_0018.gxl" class="F"/>
	<graph file="FP1_0019.gxl" class="F"/>
	<graph file="FP1_0020.gxl" class="F"/>
	<graph file="FP1_0021.gxl" class="F"/>
	<graph file="FP1_0022.gxl" class="F"/>
	<graph file="FP1_0023.gxl" class="F"/>
	<graph file="FP1_0024.gxl" class="F"/>
	<graph file="FP1_0025.gxl" class="F"/>
	<graph file="FP1_0026.gxl" class="F"/>
	<graph file="FP1_0027.gxl" class="F"/>
	<graph file="FP1_0028.gxl" class="F"/>
	<graph file="FP1_0029.gxl" class="F"/>
	<graph file="FP1_0030.gxl" class="F"/>
	<graph file="FP1_0031.gxl" class="F"/>
	<graph file="FP1_0032.gxl" class="F"/>
	<graph file="FP1_0033.gxl" class="F"/>
	<graph file="FP1_0034.gxl" class="F"/>
	<graph file="FP1_0035.gxl" class="F"/>
	<graph file="FP1_0036.gxl" class="F"/>
	<graph file="FP1_0037.gxl" class="F"/>
	<graph file="FP1_0038.gxl" class="F"/>
	<graph file="FP1_0039.gxl" class="F"/>
	<graph file="FP1_0040.gxl" class="F"/>
	<graph file="FP1_0041.gxl" class="F"/>
	<graph file="FP1_0042.gxl" class="F"/>
	<graph file="FP1_0043.gxl" class="F"/>
	<graph file="FP1_0044.gxl" class="F"/>
	<graph file="FP1_0045.gxl" class="F"/>
	<graph file="FP1_0046.gxl" class="F"/>
	<graph file="FP1_0047.gxl" class="F"/>
	<graph file="FP1_0048.gxl" class="F"/>
	<graph file="FP1_0049.gxl" class="F"/>
	<graph file="FP1_0100.gxl" class="F"/>
	<graph file="FP1_0101.gxl" class="F"/>
	<graph file="FP1_0102.gxl" class="F"/>
	<graph file="FP1_0103.gxl" class="F"/>
	<graph file="FP1_0104.gxl" class="F"/>
	<graph file="FP1_0105.gxl" class="F"/>
	<graph file="FP1_0106.gxl" class="F"/>
	<graph file="FP1_0107.gxl" class="F"/>
	<graph file="FP1_0108.gxl" class="F"/>
	<graph file="FP1_0109.gxl" class="F"/>
	<graph file="FP1_0110.gxl" class="F"/>
	<graph file="FP1_0111.gxl" class="F"/>
	<graph file="FP1_0112.gxl" class="F"/>
	<graph file="FP1_0113.gxl" class="F"/>
	<graph file="FP1_0114.gxl" class="F"/>
	<graph file="FP1_0115.gxl" class="F"/>
	<graph file="FP1_0116.gxl" class="F"/>
	<graph file="FP1_0117.gxl" class="F"/>
	<graph file="FP1_0118.gxl" class="F"/>
	<graph file="FP1_0119.gxl" class="F"/>
	<graph file="FP1_0120.gxl" class="F"/>
	<graph file="FP1_0121.gxl" class="F"/>
	<graph file="FP1_0122.gxl" class="F"/>
	<graph file="FP1_0123.gxl" class="F"/>
	<graph file="FP1_0124.gxl" class="F"/>
	<graph file="FP1_0125.gxl" class="F"/>
	<graph file="FP1_0126.gxl" class="F"/>
	<graph file="FP1_0127.gxl" class="F"/>
	<graph file="FP1_0128.gxl" class="F"/>
	<graph file="FP1_0129.gxl" class="F"/>
	<graph file="FP1_0130.gxl" class="F"/>
	<graph file="FP1_0131.gxl" class="F"/>
	<graph file="FP1_0132.gxl" class="F"/>
	<graph file="FP1_0133.gxl" class="F"/>
	<graph file="FP1_0134.gxl" class="F"/>
	<graph file="FP1_0135.gxl" class="F"/>
	<graph file="FP1_0136.gxl" class="F"/>
	<graph file="FP1_0137.gxl" class="F"/>
	<graph file="FP1_0138.gxl" class="F"/>
	<graph file="FP1_0139.gxl" class="F"/>
	<graph file="FP1_0140.gxl" class="F"/>
	<graph file="FP1_0141.gxl" class="F"/>
	<graph file="FP1_0142.gxl" class="F"/>
	<graph file="FP1_0143.gxl" class="F"/>
	<graph file="FP1_0144.gxl" class="F"/>
	<graph file="FP1_0145.gxl" class="F"/>
	<graph file="FP1_0146.gxl" class="F"/>
	<graph file="FP1_0147.gxl" class="F"/>
	<graph file="FP1_0148.gxl" class="F"/>
	<graph file="FP1_0149.gxl" class="F"/>
</GraphCollection>
