<?xml version="1.0"?>
<!DOCTYPE GraphCollection SYSTEM "http://www.inf.unibz.it/~blumenthal/dtd/GraphCollection.dtd">
<GraphCollection>
	<graph file="molid663607_subnode_9_to_Tl.gxl" class="1"/>
	<graph file="molid663607_subnode_5_to_Au.gxl" class="1"/>
	<graph file="molid663607_subnode_13_to_Na.gxl" class="1"/>
	<graph file="molid663607_subnode_14_to_Sb.gxl" class="1"/>
	<graph file="molid663607_subnode_9_to_Pb.gxl" class="1"/>
	<graph file="molid663607_addedge_1_10_label_1.gxl" class="1"/>
	<graph file="molid663607_subnode_9_to_Se.gxl" class="1"/>
	<graph file="molid663607_subnode_9_to_Sb.gxl" class="1"/>
	<graph file="molid663607_subnode_5_to_Sn.gxl" class="1"/>
	<graph file="molid663607_subnode_14_to_O.gxl" class="1"/>
	<graph file="molid663607_addnode_Mg.gxl" class="1"/>
	<graph file="molid663607_subnode_5_to_Tl.gxl" class="1"/>
	<graph file="molid663607_subnode_7_to_Pb.gxl" class="1"/>
	<graph file="molid663607_subnode_7_to_Se.gxl" class="1"/>
	<graph file="molid663607_addedge_1_31_label_1.gxl" class="1"/>
	<graph file="molid663607_subnode_5_to_C.gxl" class="1"/>
	<graph file="molid663607_subnode_1_to_Si.gxl" class="1"/>
	<graph file="molid663607_subnode_0_to_Tb.gxl" class="1"/>
	<graph file="molid663607_subnode_6_to_Na.gxl" class="1"/>
	<graph file="molid663607_subnode_13_to_Br.gxl" class="1"/>
	<graph file="molid663607_subnode_5_to_Hg.gxl" class="1"/>
	<graph file="molid663607_deledge_4_5.gxl" class="1"/>
	<graph file="molid663607_subnode_13_to_Ga.gxl" class="1"/>
	<graph file="molid663607_subnode_6_to_S.gxl" class="1"/>
	<graph file="molid663607_subnode_13_to_Sb.gxl" class="1"/>
	<graph file="molid663607_subnode_13_to_P.gxl" class="1"/>
	<graph file="molid663607_subnode_0_to_Sn.gxl" class="1"/>
	<graph file="molid663607_addedge_7_9_label_2.gxl" class="1"/>
	<graph file="molid663607_subnode_10_to_P.gxl" class="1"/>
	<graph file="molid663607_subnode_5_to_P.gxl" class="1"/>
	<graph file="molid663607_subnode_3_to_S.gxl" class="1"/>
	<graph file="molid663607_addedge_7_13_label_1.gxl" class="1"/>
	<graph file="molid663607_addnode_Na.gxl" class="1"/>
	<graph file="molid663607_subnode_7_to_Zn.gxl" class="1"/>
	<graph file="molid663607_subnode_3_to_Ru.gxl" class="1"/>
	<graph file="molid663607_subnode_3_to_Sn.gxl" class="1"/>
	<graph file="molid663607_subnode_13_to_Ge.gxl" class="1"/>
	<graph file="molid663607_addedge_3_9_label_1.gxl" class="1"/>
	<graph file="molid663607_subnode_5_to_I.gxl" class="1"/>
	<graph file="molid663607_subnode_0_to_K.gxl" class="1"/>
	<graph file="molid663607_subnode_3_to_Ga.gxl" class="1"/>
	<graph file="molid663607_subnode_0_to_F.gxl" class="1"/>
	<graph file="molid663607_subnode_7_to_Hg.gxl" class="1"/>
	<graph file="molid663607_subnode_5_to_Ni.gxl" class="1"/>
	<graph file="molid663607_subnode_7_to_Ge.gxl" class="1"/>
	<graph file="molid663607_addnode_O.gxl" class="1"/>
	<graph file="molid663607_addnode_Sb.gxl" class="1"/>
	<graph file="molid663607_deledge_0_5.gxl" class="1"/>
	<graph file="molid663607_addnode_Br.gxl" class="1"/>
	<graph file="molid663607_subnode_0_to_Ge.gxl" class="1"/>
	<graph file="molid663607_addedge_3_5_label_1.gxl" class="1"/>
	<graph file="molid663607_subnode_5_to_O.gxl" class="1"/>
	<graph file="molid663607_subnode_10_to_Te.gxl" class="1"/>
	<graph file="molid663607_subnode_3_to_Cu.gxl" class="1"/>
	<graph file="molid663607_subnode_9_to_Si.gxl" class="1"/>
	<graph file="molid663607_addedge_0_9_label_2.gxl" class="1"/>
	<graph file="molid663607_addnode_Sn.gxl" class="1"/>
	<graph file="molid663607_subnode_14_to_Cu.gxl" class="1"/>
	<graph file="molid663607_subnode_10_to_Ru.gxl" class="1"/>
	<graph file="molid663607_subnode_6_to_Sb.gxl" class="1"/>
	<graph file="molid663607_subnode_0_to_I.gxl" class="1"/>
	<graph file="molid663607_subnode_10_to_Sn.gxl" class="1"/>
	<graph file="molid663607_subedge_15_16_to_2.gxl" class="1"/>
	<graph file="molid663607_subnode_6_to_Ga.gxl" class="1"/>
	<graph file="molid663607_subnode_9_to_Te.gxl" class="1"/>
	<graph file="molid663607_addnode_As.gxl" class="1"/>
	<graph file="molid663607_subnode_1_to_Rh.gxl" class="1"/>
	<graph file="molid663607_subnode_10_to_Tb.gxl" class="1"/>
	<graph file="molid663607_addedge_9_11_label_1.gxl" class="1"/>
	<graph file="molid663607_subnode_9_to_Ho.gxl" class="1"/>
	<graph file="molid663607_deledge_1_6.gxl" class="1"/>
	<graph file="molid663607_subnode_0_to_Co.gxl" class="1"/>
	<graph file="molid663607_addedge_0_7_label_2.gxl" class="1"/>
	<graph file="molid663607_subnode_1_to_Se.gxl" class="1"/>
	<graph file="molid663607_subnode_9_to_F.gxl" class="1"/>
	<graph file="molid663607_subedge_2_3_to_2.gxl" class="1"/>
	<graph file="molid663607_subnode_14_to_Tl.gxl" class="1"/>
	<graph file="molid663607_addedge_0_13_label_2.gxl" class="1"/>
	<graph file="molid663607_addedge_7_14_label_2.gxl" class="1"/>
	<graph file="molid663607_subnode_6_to_Mg.gxl" class="1"/>
	<graph file="molid663607_deledge_2_7.gxl" class="1"/>
	<graph file="molid663607_addedge_1_5_label_1.gxl" class="1"/>
	<graph file="molid663607_subnode_7_to_P.gxl" class="1"/>
	<graph file="molid663607_subnode_0_to_Br.gxl" class="1"/>
	<graph file="molid663607_subnode_3_to_I.gxl" class="1"/>
	<graph file="molid663607_addedge_6_14_label_1.gxl" class="1"/>
	<graph file="molid663607_subnode_0_to_O.gxl" class="1"/>
	<graph file="molid663607_subnode_7_to_Rh.gxl" class="1"/>
	<graph file="molid663607_addnode_Te.gxl" class="1"/>
	<graph file="molid663607_subnode_6_to_Ge.gxl" class="1"/>
	<graph file="molid663607_subnode_9_to_O.gxl" class="1"/>
	<graph file="molid663607_addedge_9_16_label_2.gxl" class="1"/>
	<graph file="molid663607_subnode_6_to_Li.gxl" class="1"/>
	<graph file="molid663607_subnode_3_to_Ho.gxl" class="1"/>
	<graph file="molid663607_subnode_1_to_Pb.gxl" class="1"/>
	<graph file="molid663607_subnode_14_to_Ru.gxl" class="1"/>
	<graph file="molid663607_subedge_9_10_to_2.gxl" class="1"/>
	<graph file="molid663607_subnode_0_to_Sb.gxl" class="1"/>
	<graph file="molid663607_subnode_13_to_Cl.gxl" class="1"/>
	<graph file="molid663607_subnode_0_to_Se.gxl" class="1"/>
	<graph file="molid663607_subnode_14_to_Rh.gxl" class="1"/>
	<graph file="molid663607_subnode_13_to_K.gxl" class="1"/>
	<graph file="molid663607_subnode_3_to_Se.gxl" class="1"/>
	<graph file="molid663607_subnode_0_to_N.gxl" class="1"/>
	<graph file="molid663607_addedge_13_15_label_1.gxl" class="1"/>
	<graph file="molid663607_subnode_13_to_F.gxl" class="1"/>
	<graph file="molid663607_subedge_1_2_to_2.gxl" class="1"/>
	<graph file="molid663607_subnode_6_to_Au.gxl" class="1"/>
</GraphCollection>